{
  "$schema": "https://json-schema.org/draft/2020-12/schema",
  "type": "object",
  "required": [
    "assetId",
    "schemaVersion",
    "contentVersion",
    "schema",
    "authorityClass",
    "ownerContract",
    "review",
    "primarySection",
    "sections"
  ],
  "properties": {
    "assetId": {
      "const": "ai-boundary-rules"
    },
    "description": {
      "type": "string",
      "minLength": 1
    },
    "schemaVersion": {
      "type": "integer",
      "minimum": 1
    },
    "contentVersion": {
      "type": "string",
      "minLength": 1
    },
    "schema": {
      "const": "schema.json"
    },
    "authorityClass": {
      "enum": [
        "reference_dataset",
        "curated_knowledge_asset",
        "design_asset"
      ]
    },
    "ownerContract": {
      "type": "string",
      "minLength": 1
    },
    "generatedModule": {
      "type": "string",
      "minLength": 1
    },
    "runtimeProjectionAdmission": {
      "type": "string",
      "minLength": 1
    },
    "review": {
      "type": "object",
      "required": [
        "status",
        "owner",
        "reviewer",
        "lastReviewedAt"
      ],
      "properties": {
        "status": {
          "enum": [
            "reviewed",
            "needs_review",
            "rejected"
          ]
        },
        "owner": {
          "type": "string",
          "minLength": 1
        },
        "reviewer": {
          "type": [
            "string",
            "null"
          ]
        },
        "lastReviewedAt": {
          "type": [
            "string",
            "null"
          ],
          "pattern": "^\\d{4}-\\d{2}-\\d{2}$"
        }
      },
      "additionalProperties": false
    },
    "primarySection": {
      "type": "string",
      "minLength": 1
    },
    "sections": {
      "type": "array",
      "minItems": 1
    }
  },
  "additionalProperties": false
}
